{
  "engagement": {
    "client_name": "AsterNova Technologies Ltd.",
    "period": "2026-03-31",
    "currency": "INR",
    "scale": "MILLIONS",
    "framework": "US GAAP / IFRS",
    "review_stage": "CY_DRAFT_FS"
  },
  "analytics": {
    "income_statement": [
      {
        "line_item": "Revenue",
        "prior_period": 1258.59,
        "current_period": 1406.5,
        "variance": 147.91,
        "variance_pct": 11.75,
        "threshold_status": "NO",
        "commentary": "Revenue changed by $+147.91 (+11.8%) YoY."
      },
      {
        "line_item": "Cost of Goods Sold",
        "prior_period": 576.81,
        "current_period": 634.85,
        "variance": 58.04,
        "variance_pct": 10.06,
        "threshold_status": "NO",
        "commentary": "Cost of Goods Sold changed by $+58.04 (+10.1%) YoY."
      },
      {
        "line_item": "Gross Profit",
        "prior_period": 681.78,
        "current_period": 771.65,
        "variance": 89.87,
        "variance_pct": 13.18,
        "threshold_status": "NO",
        "commentary": "Gross Profit changed by $+89.87 (+13.2%) YoY."
      },
      {
        "line_item": "SG&A Expense",
        "prior_period": 336.02,
        "current_period": 353.65,
        "variance": 17.63,
        "variance_pct": 5.25,
        "threshold_status": "NO",
        "commentary": "SG&A Expense changed by $+17.63 (+5.2%) YoY."
      },
      {
        "line_item": "R&D Expense",
        "prior_period": 84.63,
        "current_period": 110.38,
        "variance": 25.75,
        "variance_pct": 30.43,
        "threshold_status": "NO",
        "commentary": "R&D Expense changed by $+25.75 (+30.4%) YoY."
      },
      {
        "line_item": "Depreciation & Amortization",
        "prior_period": 32.76,
        "current_period": 40.4,
        "variance": 7.64,
        "variance_pct": 23.32,
        "threshold_status": "NO",
        "commentary": "Depreciation & Amortization changed by $+7.64 (+23.3%) YoY."
      },
      {
        "line_item": "Total Operating Expenses",
        "prior_period": 453.41,
        "current_period": 504.43,
        "variance": 51.02,
        "variance_pct": 11.25,
        "threshold_status": "NO",
        "commentary": "Total Operating Expenses changed by $+51.02 (+11.2%) YoY."
      },
      {
        "line_item": "Operating Income",
        "prior_period": 228.36,
        "current_period": 267.22,
        "variance": 38.86,
        "variance_pct": 17.02,
        "threshold_status": "NO",
        "commentary": "Operating Income changed by $+38.86 (+17.0%) YoY."
      },
      {
        "line_item": "Interest Expense",
        "prior_period": 23.73,
        "current_period": 20.27,
        "variance": -3.46,
        "variance_pct": -14.58,
        "threshold_status": "NO",
        "commentary": "Interest Expense changed by $-3.46 (-14.6%) YoY."
      },
      {
        "line_item": "Income Tax Expense",
        "prior_period": 56.2,
        "current_period": 60.55,
        "variance": 4.35,
        "variance_pct": 7.74,
        "threshold_status": "NO",
        "commentary": "Income Tax Expense changed by $+4.35 (+7.7%) YoY."
      },
      {
        "line_item": "Net Income",
        "prior_period": 149.69,
        "current_period": 190.98,
        "variance": 41.29,
        "variance_pct": 27.58,
        "threshold_status": "NO",
        "commentary": "Net Income changed by $+41.29 (+27.6%) YoY."
      }
    ],
    "balance_sheet": [
      {
        "line_item": "Cash & Cash Equivalents",
        "prior_period": 469.12,
        "current_period": 570.8,
        "variance": 101.68,
        "variance_pct": 21.67,
        "threshold_status": "NO",
        "commentary": "Cash & Cash Equivalents changed by $+101.68 (+21.7%) YoY."
      },
      {
        "line_item": "Accounts Receivable, net",
        "prior_period": 183.5,
        "current_period": 201.7,
        "variance": 18.2,
        "variance_pct": 9.92,
        "threshold_status": "NO",
        "commentary": "Accounts Receivable, net changed by $+18.20 (+9.9%) YoY."
      },
      {
        "line_item": "Inventory",
        "prior_period": 81.73,
        "current_period": 90.47,
        "variance": 8.74,
        "variance_pct": 10.69,
        "threshold_status": "NO",
        "commentary": "Inventory changed by $+8.74 (+10.7%) YoY."
      },
      {
        "line_item": "Prepaid Expenses",
        "prior_period": 49.58,
        "current_period": 36.53,
        "variance": -13.05,
        "variance_pct": -26.32,
        "threshold_status": "NO",
        "commentary": "Prepaid Expenses changed by $-13.05 (-26.3%) YoY."
      },
      {
        "line_item": "Total Current Assets",
        "prior_period": 783.92,
        "current_period": 899.5,
        "variance": 115.58,
        "variance_pct": 14.74,
        "threshold_status": "NO",
        "commentary": "Total Current Assets changed by $+115.58 (+14.7%) YoY."
      },
      {
        "line_item": "PP&E, net",
        "prior_period": 254.25,
        "current_period": 279.78,
        "variance": 25.53,
        "variance_pct": 10.04,
        "threshold_status": "NO",
        "commentary": "PP&E, net changed by $+25.53 (+10.0%) YoY."
      },
      {
        "line_item": "Total Assets",
        "prior_period": 1103.41,
        "current_period": 1243.43,
        "variance": 140.02,
        "variance_pct": 12.69,
        "threshold_status": "NO",
        "commentary": "Total Assets changed by $+140.02 (+12.7%) YoY."
      },
      {
        "line_item": "Accounts Payable",
        "prior_period": 67.02,
        "current_period": 62.98,
        "variance": -4.04,
        "variance_pct": -6.03,
        "threshold_status": "NO",
        "commentary": "Accounts Payable changed by $-4.04 (-6.0%) YoY."
      },
      {
        "line_item": "Accrued Expenses",
        "prior_period": 160.33,
        "current_period": 205.72,
        "variance": 45.39,
        "variance_pct": 28.31,
        "threshold_status": "NO",
        "commentary": "Accrued Expenses changed by $+45.39 (+28.3%) YoY."
      },
      {
        "line_item": "Total Current Liabilities",
        "prior_period": 328.43,
        "current_period": 372.24,
        "variance": 43.81,
        "variance_pct": 13.34,
        "threshold_status": "NO",
        "commentary": "Total Current Liabilities changed by $+43.81 (+13.3%) YoY."
      },
      {
        "line_item": "Long-term Debt",
        "prior_period": 294.82,
        "current_period": 284.71,
        "variance": -10.11,
        "variance_pct": -3.43,
        "threshold_status": "NO",
        "commentary": "Long-term Debt changed by $-10.11 (-3.4%) YoY."
      },
      {
        "line_item": "Total Liabilities",
        "prior_period": 623.26,
        "current_period": 656.95,
        "variance": 33.69,
        "variance_pct": 5.41,
        "threshold_status": "NO",
        "commentary": "Total Liabilities changed by $+33.69 (+5.4%) YoY."
      },
      {
        "line_item": "Common Stock",
        "prior_period": 131.34,
        "current_period": 131.34,
        "variance": 0.0,
        "variance_pct": 0.0,
        "threshold_status": "NO",
        "commentary": "Common Stock changed by $+0.00 (+0.0%) YoY."
      },
      {
        "line_item": "Retained Earnings",
        "prior_period": 184.48,
        "current_period": 290.81,
        "variance": 106.33,
        "variance_pct": 57.64,
        "threshold_status": "NO",
        "commentary": "Retained Earnings changed by $+106.33 (+57.6%) YoY."
      },
      {
        "line_item": "Total Equity",
        "prior_period": 480.15,
        "current_period": 586.48,
        "variance": 106.33,
        "variance_pct": 22.15,
        "threshold_status": "NO",
        "commentary": "Total Equity changed by $+106.33 (+22.1%) YoY."
      }
    ],
    "ratios": [
      {
        "category": "Liquidity",
        "name": "Current Ratio",
        "formula": "Total Current Assets / Total Current Liabilities",
        "prior_period": 2.39,
        "current_period": 2.42,
        "benchmark": "1.00x to 3.00x",
        "status": "PASS",
        "assessment": "Current Ratio is 2.42x vs prior period 2.39."
      },
      {
        "category": "Liquidity",
        "name": "Quick Ratio (Acid-Test)",
        "formula": "(Cash & Cash Equivalents + Accounts Receivable) / Total Current Liabilities",
        "prior_period": 1.99,
        "current_period": 2.08,
        "benchmark": ">= 1.00x",
        "status": "PASS",
        "assessment": "Quick Ratio (Acid-Test) is 2.08x vs prior period 1.99."
      },
      {
        "category": "Leverage",
        "name": "Debt-to-Equity Ratio",
        "formula": "(Short-Term Debt + Long-Term Debt) / Total Stockholders' Equity",
        "prior_period": 0.82,
        "current_period": 0.66,
        "benchmark": "0.10x to 4.00x",
        "status": "PASS",
        "assessment": "Debt-to-Equity Ratio is 0.66x vs prior period 0.82."
      },
      {
        "category": "Solvency",
        "name": "Interest Coverage Ratio",
        "formula": "Operating Income / Interest Expense",
        "prior_period": 9.62,
        "current_period": 13.18,
        "benchmark": ">= 2.50x",
        "status": "PASS",
        "assessment": "Interest Coverage Ratio is 13.18x vs prior period 9.62."
      },
      {
        "category": "Activity",
        "name": "Days Sales Outstanding (DSO)",
        "formula": "(Accounts Receivable / Total Revenue) * 365",
        "prior_period": 53.2,
        "current_period": 52.3,
        "benchmark": "30 to 90 Days",
        "status": "PASS",
        "assessment": "Days Sales Outstanding (DSO) is 52.3 Days vs prior period 53.20."
      },
      {
        "category": "Activity",
        "name": "Days Inventory Outstanding (DIO)",
        "formula": "(Ending Inventory / Cost of Goods Sold) * 365",
        "prior_period": 51.7,
        "current_period": 52.0,
        "benchmark": "<= 90 Days",
        "status": "PASS",